{"agent":"aara-status-deck","agent_version":"1.3","requested_stage":"pilot","decision":"CONDITIONAL_PASS","design_score":77,"design_band":"prototype","behavior_evaluated":false,"evidence":{"runnable_artifact":true,"agent_spec":true,"io_contracts":true,"guardrails":true,"review_scorecard":true,"eval_plan":true,"executed_eval_results":false},"conditions":["Scope the tool list (drop Bash)","Run + pass the eval suite before production"],"required_fixes":[{"priority":"P0","fix":"run eval plan","required_before":"production"}]}
